{
  "$schema": "http://json-schema.org/draft-07/schema#",
  "$id": "https://github.com/philipdallen/PleaNP/tooling/gates/specs/rendering_disagreement.schema.json",
  "title": "Rendering-disagreement review spec",
  "description": "Spec for a human review of a multi-rendering disagreement: 3-5 tiny, independent, concrete probes answerable from basic math/logic against the Lean renderings. One wrong probe = the claim is wrong (blocked).",
  "type": "object",
  "additionalProperties": false,
  "required": ["campaign", "lens_a", "lens_b", "informal_claim", "probes"],
  "properties": {
    "campaign": { "type": "string", "minLength": 1, "description": "Slug of the rendering campaign (e.g. bgs-clause-b) that produced the disagreement" },
    "lens_a": { "type": "string", "description": "Named lens of rendering A (e.g. structure-first)" },
    "lens_b": { "type": "string", "description": "Named lens of rendering B (e.g. witness-predicate)" },
    "informal_claim": { "type": "string", "description": "The informal step-0 claim the renderings both target" },
    "batch_narrative": { "type": "string", "description": "Optional recap paragraph prepended to the checklist (Option 3)" },
    "probes": {
      "type": "array",
      "minItems": 3,
      "maxItems": 5,
      "items": {
        "type": "object",
        "additionalProperties": false,
        "required": ["key", "kind", "question", "choices", "expected", "hint"],
        "properties": {
          "key": { "type": "string", "minLength": 1, "description": "Unique probe id within the spec (e.g. q1)" },
          "kind": { "type": "string", "description": "Probe kind: quantifier / direction / bound / existence, or a campaign-specific kind" },
          "question": { "type": "string", "description": "The tiny concrete yes/no-or-pick-one question the human answers" },
          "choices": { "type": "array", "minItems": 1, "items": { "type": "string" }, "description": "Answer options (the expected value must be one of them)" },
          "expected": { "type": "string", "description": "The machine-derived expected answer (from the Lean renderings, not the informal wish" },
          "hint": { "type": "string", "description": "Plain-language hint / inline gloss for the probe" },
          "gloss": { "type": "string", "description": "Optional inline gloss for a non-core term mentioned in the question" }
        }
      }
    }
  }
}